{
  "schema_version": 1,
  "id": "cheonggyecheon-samil",
  "status": "draft",
  "name": { "ko": "청계2가 삼일교" },

  "viewpoint": {
    "lat": 37.5680,
    "lng": 126.9880,
    "heading_deg": 0,
    "pitch_deg": -5,
    "hfov_deg": 55,
    "eye_height_m": 6,
    "confidence": "rough",
    "surveyed_at": null,
    "notes": "3.1로(현 삼일대로) 확장공사 구간을 북쪽으로 내려다본 사진. 원본 확인 결과 영구 기준점이 둘: (1) 화면 중앙 상단 북악산 정상 — 뾰족한 봉우리 형태로 식별, (2) 화면 우측 상단 고딕 첨탑 — 명동성당으로 추정. 두 기준점이 다 보이므로 현장에서 삼각측량으로 촬영 지점을 좁힐 수 있다. 명동성당이 우측(동쪽)에 보이려면 시점은 성당 남서쪽이어야 하는데 삼일대로는 성당 동쪽이다 — 좌표·방위 추정이 서로 안 맞으므로 이 값은 rough. 시점 높이 2~3층(6m 가정), 지상과 다르니 능선·첨탑·도로축 위주로 정렬하고 근경 건물은 시차 감안. 좌측 대형 벽돌 건물(굴뚝 있음)도 단서 — 현존 여부 확인 필요. 우측 하단 간판: '수운집', '경원 꽃집', '치과'."
  },

  "guide": {
    "instruction": { "ko": "삼일대로 남쪽(퇴계로 방면)에서 북쪽으로 서서, 정면에 북악산 봉우리, 오른쪽 위에 명동성당 첨탑이 보이는 자리를 찾으세요." },
    "stand_here_image": null,
    "landmarks": [
      { "label": { "ko": "북악산 정상 (화면 중앙 상단)" }, "bearing_deg": 0 },
      { "label": { "ko": "명동성당 첨탑 (화면 우측 상단, 추정)" } },
      { "label": { "ko": "삼일대로 도로축 (화면 중앙으로 수렴)" } }
    ]
  },

  "present": null,

  "historical": [
    {
      "id": "1967-samil-ro",
      "title": { "ko": "3.1로 확장공사" },
      "year": 1967,
      "year_precision": "exact",
      "date": "1967-03-18",
      "media_type": "photo",
      "description": { "ko": "퇴계로에서 중앙극장 앞을 거쳐 청계천에 이르는 3.1로 확장공사 현장이다. (내용출처: 매일경제, 1967.03.16., 1면)" },
      "image": {
        "file": "1967-samil-ro.jpg",
        "original_ref": "https://archives.seoul.go.kr/item/2621",
        "original_px": { "w": 1304, "h": 1074 },
        "crop": null
      },
      "source": {
        "org": "서울기록원",
        "archive_id": "RG5-SR79-IT2621",
        "url": "https://archives.seoul.go.kr/item/2621",
        "producer": "서울특별시 공보실"
      },
      "license": {
        "type": "KOGL-1",
        "evidence": "metadata",
        "evidence_url": "https://archives.seoul.go.kr/item/2621",
        "evidence_quote": "법적지위 공공기록 / 접근유형 공개 / 이용유형 제한없음. 서울시 보도자료(2016-02-04): 아카이브 내 모든 사진의 저작권은 서울시에 있기 때문에 출처만 정확하게 표기하면 상업적으로도 이용이 가능하고 변경금지 제한도 없어",
        "attribution": "본 저작물은 서울기록원에서 개방한 '3.1로 확장공사'(RG5-SR79-IT2621, 서울특별시 공보실, 1967)를 이용하였습니다. https://archives.seoul.go.kr/item/2621",
        "checked_at": "2026-09-10"
      },
      "alignment": {
        "hints": [
          { "label": { "ko": "북악산 정상" }, "point": { "x": 0.49, "y": 0.24 }, "still_exists": true },
          { "label": { "ko": "명동성당 첨탑 (추정)" }, "point": { "x": 0.96, "y": 0.26 }, "still_exists": true },
          { "label": { "ko": "삼일대로 도로축" }, "point": { "x": 0.5, "y": 0.6 }, "still_exists": true },
          { "label": { "ko": "좌측 벽돌 건물 (현존 미확인)" }, "point": { "x": 0.15, "y": 0.4 }, "still_exists": false }
        ]
      }
    }
  ]
}
